{
    "thread": {
        "uuid": "e4818355648c9cd14226653652f006b994a7dc4b",
        "url": "https://www.chatsports.com/liverpool/a/source/mohamed-salah-misses-another-penalty-but-has-his-blushes-spared-after-shot-crashes-off-crossbar-before-hitting-the-goalkeepers-backside-to-go-in-as-liverpool-star-helps-egypt-to-a-2-0-win-in-afcon-warm-up-friendly-17769857",
        "site_full": "www.chatsports.com",
        "site": "chatsports.com",
        "site_section": "https://chatsports.com/liverpool",
        "site_categories": [
            "football",
            "sports"
        ],
        "section_title": "Liverpool News &amp; Rumors",
        "title": "Mohamed Salah MISSES another penalty but has his blushes spared after shot crashes off crossbar before hitting the goalkeeper's BACKSIDE to go in - as Liverpool star helps Egypt to a 2-0 win in AFCON warm-up friendly",
        "title_full": "Mohamed Salah MISSES another penalty but has his blushes spared after shot crashes off crossbar before hitting the goalkeeper's BACKSIDE to go in - as Liverpool star helps Egypt to a 2-0 win in AFCON warm-up friendly",
        "published": "2024-01-08T01:30:00.000+02:00",
        "replies_count": 0,
        "participants_count": 1,
        "site_type": "news",
        "country": "US",
        "main_image": "http://cdn.chatsports.com/thumbnails/6609-13858-original.jpeg",
        "performance_score": 0,
        "domain_rank": 81786,
        "domain_rank_updated": "2024-01-02T12:06:57.000+02:00",
        "reach": null,
        "social": {
            "facebook": {
                "likes": 0,
                "comments": 0,
                "shares": 0
            },
            "gplus": {
                "shares": 0
            },
            "pinterest": {
                "shares": 0
            },
            "linkedin": {
                "shares": 0
            },
            "stumbledupon": {
                "shares": 0
            },
            "vk": {
                "shares": 0
            }
        }
    },
    "uuid": "e4818355648c9cd14226653652f006b994a7dc4b",
    "url": "https://www.chatsports.com/liverpool/a/source/mohamed-salah-misses-another-penalty-but-has-his-blushes-spared-after-shot-crashes-off-crossbar-before-hitting-the-goalkeepers-backside-to-go-in-as-liverpool-star-helps-egypt-to-a-2-0-win-in-afcon-warm-up-friendly-17769857",
    "ord_in_thread": 0,
    "parent_url": null,
    "author": "Daily Mail",
    "published": "2024-01-08T01:30:00.000+02:00",
    "title": "Mohamed Salah MISSES another penalty but has his blushes spared after shot crashes off crossbar before hitting the goalkeeper's BACKSIDE to go in - as Liverpool star helps Egypt to a 2-0 win in AFCON warm-up friendly",
    "text": "Back to the Liverpool Newsfeed Mohamed Salah MISSES another penalty but has his blushes spared after shot crashes off crossbar before hitting the goalkeeper's BACKSIDE to go in - as Liverpool star helps Egypt to a 2-0 win in AFCON warm-up friendly Daily Mail | January 7, 2024 Related Topics: Norby Williamson , Pat McAfee , Travis Kelce , Jack Squirek SPORTS Digest Aaron Rodgers is seen for the first time since claiming Jimmy Kimmel would be named on Epstein list Braves the snow to watch Jets in season finale Wrexham's A-List owner Ryan Reynolds and Hollywood pal Hugh Jackman celebrate the Welsh soccer team's 'HUGE' FA Cup win To make fourth round Mary Lou Retton reveals she was almost put on life support and insists she is 'blessed to be here' Was hospitalized with rare form of pneumonia Pat McAfee posts cryptic 'Scarface' clip on social media amid ESPN controversy Claimed executive Norby Williamson is trying to SABOTAGE his show Travis Kelce and the Chiefs touch down in Los Angeles ahead of NFL season finale against the Chargers Where Taylor Swift enjoyed a girls' night out MORE SPORTS STARS McAfee signs autographs for fans at Colts-Texans game as he puts ESPN controversy behind him After claiming exec is trying to 'sabotage' show Fans poke fun at Ravens star Agholor after he fell agonizing 19 YARDS short of season target Would have earned himself a $250k bonus EXCLUSIVE Kelce is seen at a Kansas City Panera Bread drive thru before taking off with his Chiefs teammates to LA Where girlfriend Taylor Swift has been spotted Ex-Las Vegas Raiders star Squirek dead at 64: Team pays tribute to linebacker who touchdown helped them win Super Bowl in 1984 Survived by his wife Dunne wows fans with brand new training video and backstage selfie. See full article at Daily Mail ChatSports Open in App Home Teams MLB MLB Arizona Diamondbacks Atlanta Braves Baltimore Orioles Boston Red Sox Chicago Cubs Chicago White Sox Cincinnati Reds Cleveland Guardians Colorado Rockies Detroit Tigers Houston Astros Kansas City Royals Los Angeles Angels Los Angeles Dodgers Miami Marlins Milwaukee Brewers Minnesota Twins New York Mets New York Yankees Oakland Athletics Philadelphia Phillies Pittsburgh Pirates San Diego Padres San Francisco Giants Seattle Mariners St. Louis Cardinals Tampa Bay Rays Texas Rangers Toronto Blue Jays Washington Nationals NBA NBA Atlanta Hawks Boston Celtics Brooklyn Nets Charlotte Hornets Chicago Bulls Cleveland Cavaliers Dallas Mavericks Denver Nuggets Detroit Pistons Golden State Warriors Houston Rockets Indiana Pacers Los Angeles Clippers Los Angeles Lakers Memphis Grizzlies Miami Heat Milwaukee Bucks Minnesota Timberwolves New Orleans Pelicans New York Knicks Oklahoma City Thunder Orlando Magic Philadelphia 76ers Phoenix Suns Portland Trail Blazers Sacramento Kings San Antonio Spurs Toronto Raptors Utah Jazz Washington Wizards NCAA NCAA ACC Boston College Eagles Clemson Tigers Duke Blue Devils Florida State Seminoles Georgia Tech Yellow Jackets Louisville Cardinals Miami Hurricanes North Carolina State Wolfpack North Carolina Tar Heels Pitt Panthers Syracuse Orange Virginia Cavaliers Virginia Tech Hokies Wake Forest Demon Deacons American Athletic Cincinnati Bearcats East Carolina Pirates Houston Cougars Memphis Tigers Navy Midshipmen SMU Mustangs South Florida Bulls Temple Owls Tulane Green Wave Tulsa Golden Hurricane UCF Knights Wichita State Shockers Big 12 Baylor Bears Iowa State Cyclones Kansas Jayhawks Kansas State Wildcats Oklahoma Sooners Oklahoma State Cowboys TCU Horned Frogs Texas Longhorns Texas Tech Red Raiders West Virginia Mountaineers Big East Butler Bulldogs Creighton Blue Jays DePaul Blue Demons Georgetown Hoyas Marquette Golden Eagles Providence Friars Seton Hall Pirates St Johns Red Storm UCONN Huskies Villanova Wildcats Xavier Musketeers Big Ten Illinois Fighting Illini Indiana Hoosiers Iowa Hawkeyes Maryland Terrapins Michigan State Spartans Michigan Wolverines Minnesota Golden Gophers Nebraska Cornhuskers Northwestern Wildcats Ohio State Buckeyes Penn State Nittany Lions Purdue Boilermakers Rutgers Scarlet Knights Wisconsin Badgers Conference USA Charlotte 49ers Florida Atlantic Owls Florida International Golden Panthers Louisiana Tech Bulldogs Marshall Thundering Herd Middle Tennessee Blue Raiders North Texas Mean Green Old Dominion Monarchs Rice Owls Southern Mississippi Golden Eagles UAB Blazers UTEP Miners UTSA Roadrunners Western Kentucky Hilltoppers FBS Independents Army Black Knights BYU Cougars Notre Dame Fighting Irish Mid-American Akron Zips Ball State Cardinals Bowling Green Falcons Buffalo Bulls Central Michigan Chippewas Eastern Michigan Eagles Kent State Golden Flashes Miami Redhawks Northern Illinois Huskies Toledo Rockets Western Michigan Broncos Missouri Valley Bradley Braves Drake Bulldogs Evansville Purple Aces Illinois State Redbirds Indiana State Sycamores Loyola Ramblers Missouri State Bears Northern Iowa Panthers Southern Illinois Salukis Valparaiso Crusaders Mountain West Air Force Falcons Boise State Broncos Colorado State Rams Fresno State Bulldogs Hawaii Warriors Nevada Wolfpack New Mexico Lobos San Diego State Aztecs San Jose State Spartans UNLV Rebels Utah State Aggies Wyoming Cowboys Pac-12 Arizona State Sun Devils Arizona Wildcats Cal Golden Bears Colorado Buffaloes Oregon Ducks Oregon State Beavers Stanford Cardinal UCLA Bruins USC Trojans Utah Utes Washington Huskies Washington State Cougars SEC Alabama Crimson Tide Arkansas Razorbacks Auburn Tigers Florida Gators Georgia Bulldogs Kentucky Wildcats LSU Tigers Mississippi Rebels Mississippi State Bulldogs Missouri Tigers South Carolina Gamecocks Tennessee Volunteers Texas A&M Aggies Vanderbilt Commodores Sun Belt Appalachian State Mountaineers Arkansas State Red Wolves Arkansas-Little Rock Trojans Coastal Carolina Chanticleers Georgia Southern Eagles Georgia State Panthers Idaho Vandals Louisiana Lafayette Ragin Cajuns Louisiana Monroe Warhawks New Mexico State Aggies South Alabama Jaguars Texas State Bobcats Troy Trojans UT-Arlington Mavericks West Coast Conference Gonzaga Bulldogs Loyola Marymount Lions Pacific Tigers Pepperdine Waves Portland Pilots Saint Marys Gaels San Diego Toreros San Francisco Dons Santa Clara Broncos NFL NFL Arizona Cardinals Atlanta Falcons Baltimore Ravens Buffalo Bills Carolina Panthers Chicago Bears Cincinnati Bengals Cleveland Browns Dallas Cowboys Denver Broncos Detroit Lions Green Bay Packers Houston Texans Indianapolis Colts Jacksonville Jaguars Kansas City Chiefs Las Vegas Raiders Los Angeles Chargers Los Angeles Rams Miami Dolphins Minnesota Vikings New England Patriots New Orleans Saints New York Giants New York Jets Philadelphia Eagles Pittsburgh Steelers San Francisco 49ers Seattle Seahawks Tampa Bay Buccaneers Tennessee Titans Washington Commanders NHL NHL Anaheim Ducks Arizona Coyotes Boston Bruins Buffalo Sabres Calgary Flames Carolina Hurricanes Chicago Blackhawks Colorado Avalanche Columbus Blue Jackets Dallas Stars Detroit Red Wings Edmonton Oilers Florida Panthers Los Angeles Kings Minnesota Wild Montreal Canadiens Nashville Predators New Jersey Devils New York Islanders New York Rangers Ottawa Senators Philadelphia Flyers Pittsburgh Penguins San Jose Sharks St. Louis Blues Tampa Bay Lightning Toronto Maple Leafs Vancouver Canucks Vegas Golden Knights Washington Capitals Winnipeg Jets Soccer Soccer MLS Atlanta United Chicago Fire Colorado Rapids Columbus Crew DC United FC Dallas Houston Dynamo Los Angeles Galaxy Minnesota United Montreal Impact New England Revolution New York City FC New York Red Bulls Orlando City SC Philadelphia Union Portland Timbers Real Salt Lake San Jose Earthquakes Seattle Sounders Sporting KC Toronto FC Vancouver Whitecaps National Teams United States United States Women Premier League Arsenal Bournemouth Burnley Clarets Chelsea Crystal Palace Everton Hull City Leicester City Liverpool Manchester City Manchester United Middlesbrough Newcastle United Southampton Stoke City Sunderland Swansea City Tottenham Hotspur Watford West Bromwich Albion West Ham United Other Auto Racing Facebook Live Fantasy Football Golf Local MMA Olympics Poker Rumors Humor Sports Tech Tennis Top News Teams: No teams found. Users: No users found. Log In © Chat Sports, Inc. 2024 About Us Mobile Writers Archive Original Content Topic Search Chat Sports On Youtube Cowboys Report by Chat Sports Raiders Report by Chat Sports Jobs Terms Privacy Contact Us Teams: No teams found. Users: No users found. Home Teams MLB Arizona Diamondbacks Atlanta Braves Baltimore Orioles Boston Red Sox Chicago Cubs Chicago White Sox Cincinnati Reds Cleveland Guardians Colorado Rockies Detroit Tigers Houston Astros Kansas City Royals Los Angeles Angels Los Angeles Dodgers Miami Marlins Milwaukee Brewers Minnesota Twins New York Mets New York Yankees Oakland Athletics Philadelphia Phillies Pittsburgh Pirates San Diego Padres San Francisco Giants Seattle Mariners St. Louis Cardinals Tampa Bay Rays Texas Rangers Toronto Blue Jays Washington Nationals NBA Atlanta Hawks Boston Celtics Brooklyn Nets Charlotte Hornets Chicago Bulls Cleveland Cavaliers Dallas Mavericks Denver Nuggets Detroit Pistons Golden State Warriors Houston Rockets Indiana Pacers Los Angeles Clippers Los Angeles Lakers Memphis Grizzlies Miami Heat Milwaukee Bucks Minnesota Timberwolves New Orleans Pelicans New York Knicks Oklahoma City Thunder Orlando Magic Philadelphia 76ers Phoenix Suns Portland Trail Blazers Sacramento Kings San Antonio Spurs Toronto Raptors Utah Jazz Washington Wizards NCAA ACC - Boston College Eagles ACC - Clemson Tigers ACC - Duke Blue Devils ACC - Florida State Seminoles ACC - Georgia Tech Yellow Jackets ACC - Louisville Cardinals ACC - Miami Hurricanes ACC - North Carolina State Wolfpack ACC - North Carolina Tar Heels ACC - Pitt Panthers ACC - Syracuse Orange ACC - Virginia Cavaliers ACC - Virginia Tech Hokies ACC - Wake Forest Demon Deacons American Athletic - Cincinnati Bearcats American Athletic - East Carolina Pirates American Athletic - Houston Cougars American Athletic - Memphis Tigers American Athletic - Navy Midshipmen American Athletic - SMU Mustangs American Athletic - South Florida Bulls American Athletic - Temple Owls American Athletic - Tulane Green Wave American Athletic - Tulsa Golden Hurricane American Athletic - UCF Knights American Athletic - Wichita State Shockers Big 12 - Baylor Bears Big 12 - Iowa State Cyclones Big 12 - Kansas Jayhawks Big 12 - Kansas State Wildcats Big 12 - Oklahoma Sooners Big 12 - Oklahoma State Cowboys Big 12 - TCU Horned Frogs Big 12 - Texas Longhorns Big 12 - Texas Tech Red Raiders Big 12 - West Virginia Mountaineers Big East - Butler Bulldogs Big East - Creighton Blue Jays Big East - DePaul Blue Demons Big East - Georgetown Hoyas Big East - Marquette Golden Eagles Big East - Providence Friars Big East - Seton Hall Pirates Big East - St Johns Red Storm Big East - UCONN Huskies Big East - Villanova Wildcats Big East - Xavier Musketeers Big Ten - Illinois Fighting Illini Big Ten - Indiana Hoosiers Big Ten - Iowa Hawkeyes Big Ten - Maryland Terrapins Big Ten - Michigan State Spartans Big Ten - Michigan Wolverines Big Ten - Minnesota Golden Gophers Big Ten - Nebraska Cornhuskers Big Ten - Northwestern Wildcats Big Ten - Ohio State Buckeyes Big Ten - Penn State Nittany Lions Big Ten - Purdue Boilermakers Big Ten - Rutgers Scarlet Knights Big Ten - Wisconsin Badgers Conference USA - Charlotte 49ers Conference USA - Florida Atlantic Owls Conference USA - Florida International Golden Panthers Conference USA - Louisiana Tech Bulldogs Conference USA - Marshall Thundering Herd Conference USA - Middle Tennessee Blue Raiders Conference USA - North Texas Mean Green Conference USA - Old Dominion Monarchs Conference USA - Rice Owls Conference USA - Southern Mississippi Golden Eagles Conference USA - UAB Blazers Conference USA - UTEP Miners Conference USA - UTSA Roadrunners Conference USA - Western Kentucky Hilltoppers FBS Independents - Army Black Knights FBS Independents - BYU Cougars FBS Independents - Notre Dame Fighting Irish Mid-American - Akron Zips Mid-American - Ball State Cardinals Mid-American - Bowling Green Falcons Mid-American - Buffalo Bulls Mid-American - Central Michigan Chippewas Mid-American - Eastern Michigan Eagles Mid-American - Kent State Golden Flashes Mid-American - Miami Redhawks Mid-American - Northern Illinois Huskies Mid-American - Toledo Rockets Mid-American - Western Michigan Broncos Missouri Valley - Bradley Braves Missouri Valley - Drake Bulldogs Missouri Valley - Evansville Purple Aces Missouri Valley - Illinois State Redbirds Missouri Valley - Indiana State Sycamores Missouri Valley - Loyola Ramblers Missouri Valley - Missouri State Bears Missouri Valley - Northern Iowa Panthers Missouri Valley - Southern Illinois Salukis Missouri Valley - Valparaiso Crusaders Mountain West - Air Force Falcons Mountain West - Boise State Broncos Mountain West - Colorado State Rams Mountain West - Fresno State Bulldogs Mountain West - Hawaii Warriors Mountain West - Nevada Wolfpack Mountain West - New Mexico Lobos Mountain West - San Diego State Aztecs Mountain West - San Jose State Spartans Mountain West - UNLV Rebels Mountain West - Utah State Aggies Mountain West - Wyoming Cowboys Pac-12 - Arizona State Sun Devils Pac-12 - Arizona Wildcats Pac-12 - Cal Golden Bears Pac-12 - Colorado Buffaloes Pac-12 - Oregon Ducks Pac-12 - Oregon State Beavers Pac-12 - Stanford Cardinal Pac-12 - UCLA Bruins Pac-12 - USC Trojans Pac-12 - Utah Utes Pac-12 - Washington Huskies Pac-12 - Washington State Cougars SEC - Alabama Crimson Tide SEC - Arkansas Razorbacks SEC - Auburn Tigers SEC - Florida Gators SEC - Georgia Bulldogs SEC - Kentucky Wildcats SEC - LSU Tigers SEC - Mississippi Rebels SEC - Mississippi State Bulldogs SEC - Missouri Tigers SEC - South Carolina Gamecocks SEC - Tennessee Volunteers SEC - Texas A&M Aggies SEC - Vanderbilt Commodores Sun Belt - Appalachian State Mountaineers Sun Belt - Arkansas State Red Wolves Sun Belt - Arkansas-Little Rock Trojans Sun Belt - Coastal Carolina Chanticleers Sun Belt - Georgia Southern Eagles Sun Belt - Georgia State Panthers Sun Belt - Idaho Vandals Sun Belt - Louisiana Lafayette Ragin Cajuns Sun Belt - Louisiana Monroe Warhawks Sun Belt - New Mexico State Aggies Sun Belt - South Alabama Jaguars Sun Belt - Texas State Bobcats Sun Belt - Troy Trojans Sun Belt - UT-Arlington Mavericks West Coast Conference - Gonzaga Bulldogs West Coast Conference - Loyola Marymount Lions West Coast Conference - Pacific Tigers West Coast Conference - Pepperdine Waves West Coast Conference - Portland Pilots West Coast Conference - Saint Marys Gaels West Coast Conference - San Diego Toreros West Coast Conference - San Francisco Dons West Coast Conference - Santa Clara Broncos NFL Arizona Cardinals Atlanta Falcons Baltimore Ravens Buffalo Bills Carolina Panthers Chicago Bears Cincinnati Bengals Cleveland Browns Dallas Cowboys Denver Broncos Detroit Lions Green Bay Packers Houston Texans Indianapolis Colts Jacksonville Jaguars Kansas City Chiefs Las Vegas Raiders Los Angeles Chargers Los Angeles Rams Miami Dolphins Minnesota Vikings New England Patriots New Orleans Saints New York Giants New York Jets Philadelphia Eagles Pittsburgh Steelers San Francisco 49ers Seattle Seahawks Tampa Bay Buccaneers Tennessee Titans Washington Commanders NHL Anaheim Ducks Arizona Coyotes Boston Bruins Buffalo Sabres Calgary Flames Carolina Hurricanes Chicago Blackhawks Colorado Avalanche Columbus Blue Jackets Dallas Stars Detroit Red Wings Edmonton Oilers Florida Panthers Los Angeles Kings Minnesota Wild Montreal Canadiens Nashville Predators New Jersey Devils New York Islanders New York Rangers Ottawa Senators Philadelphia Flyers Pittsburgh Penguins San Jose Sharks St. Louis Blues Tampa Bay Lightning Toronto Maple Leafs Vancouver Canucks Vegas Golden Knights Washington Capitals Winnipeg Jets Soccer MLS National Teams Premier League Other Auto Racing Facebook Live Fantasy Football Golf Local MMA Olympics Poker Rumors Humor Sports Tech Tennis Top News Follow @chatsports Download the app",
    "highlightText": "",
    "highlightTitle": "",
    "highlightThreadTitle": "",
    "language": "english",
    "sentiment": "positive",
    "categories": [
        "Arts, Culture and Entertainment",
        "Sport",
        "Human Interest"
    ],
    "external_links": [],
    "external_images": [],
    "entities": {
        "persons": [
            {
                "name": "mohamed salah",
                "sentiment": "neutral"
            },
            {
                "name": "pat mcafee",
                "sentiment": "none"
            },
            {
                "name": "jimmy kimmel",
                "sentiment": "none"
            },
            {
                "name": "taylor swift",
                "sentiment": "none"
            },
            {
                "name": "travis kelce",
                "sentiment": "none"
            },
            {
                "name": "ryan reynolds",
                "sentiment": "none"
            },
            {
                "name": "jack squirek",
                "sentiment": "none"
            },
            {
                "name": "epstein",
                "sentiment": "none"
            },
            {
                "name": "mary lou retton",
                "sentiment": "none"
            },
            {
                "name": "norby williamson",
                "sentiment": "none"
            },
            {
                "name": "aaron rodgers",
                "sentiment": "none"
            },
            {
                "name": "hugh jackman",
                "sentiment": "none"
            }
        ],
        "organizations": [
            {
                "name": "liverpool newsfeed mohamed salah",
                "sentiment": "neutral"
            },
            {
                "name": "liverpool",
                "sentiment": "neutral"
            },
            {
                "name": "nfl",
                "sentiment": "none"
            },
            {
                "name": "braves",
                "sentiment": "none"
            },
            {
                "name": "afcon",
                "sentiment": "none"
            },
            {
                "name": "wrexham",
                "sentiment": "none"
            },
            {
                "name": "espn",
                "sentiment": "none"
            }
        ],
        "locations": [
            {
                "name": "egypt",
                "sentiment": "none"
            },
            {
                "name": "afcon",
                "sentiment": "none"
            },
            {
                "name": "hollywood",
                "sentiment": "none"
            },
            {
                "name": "liverpool",
                "sentiment": "none"
            },
            {
                "name": "los angeles",
                "sentiment": "none"
            }
        ]
    },
    "rating": null,
    "crawled": "2024-01-08T01:43:18.396+02:00",
    "updated": "2024-01-08T01:43:18.396+02:00"
}